{
  "gcp_version": "0.1",
  "receipt_id": "urn:gcp:receipt:001",
  "capsule_digest": "sha256:dddddddddddddddddddddddddddddddddddddddddddddddddddddddddddddddd",
  "task_id": "urn:gcp:task:compliance-check-001",
  "runtime": "spiffe://example.com/runtime/compliance-1",
  "action": "vendor.read",
  "resource": "https://api.example.com/vendors/acme/compliance",
  "decision": "ALLOW_WITH_CONTROLS",
  "controls": ["enhanced-audit", "eu-only-processing"],
  "reason_codes": ["GCP_LOCAL_POLICY_CONSTRAINT"],
  "timestamp": "2026-08-12T01:10:00Z",
  "freshness_evidence": {"profile": "online-strict", "last_status_at": "2026-08-12T01:09:59Z", "status_digest": "sha256:3333333333333333333333333333333333333333333333333333333333333333"},
  "evidence": [{"uri": "https://audit.example.com/traces/trace-001", "digest": "sha256:4444444444444444444444444444444444444444444444444444444444444444", "media_type": "application/json"}],
  "proof": {"type": "DataIntegrityProof", "cryptosuite": "eddsa-jcs-2022", "verification_method": "spiffe://example.com/runtime/compliance-1#key", "created": "2026-08-12T01:10:00Z", "proof_purpose": "assertionMethod", "proof_value": "ZmFrZS1yZWNlaXB0"}
}
